{
	"domain": "causal-structure-and-singularities",
	"title": "Causal structure, asymptotics and singularities",
	"scope": "Global, whole-spacetime methods for arbitrary Lorentzian spacetimes. Causal curves, time orientation, causal and chronological futures and pasts, closed timelike curves and spacetime topology; time functions, domains of dependence, Cauchy surfaces and horizons, global hyperbolicity and existence of maximal curves. Conformal compactification and Penrose diagrams as a technique, with Minkowski space as the model, plus conformal infinity (i+, i-, i0, null infinity) and asymptotic flatness. Horizons as causal boundaries in general, trapped and marginally trapped surfaces. Geodesic congruences with expansion, shear and rotation, the timelike and null Raychaudhuri equations, convergence conditions, focusing and caustics. Singularities as geodesic incompleteness and inextendibility, curvature, spacelike, timelike and naked singularities and their classification (including BKL), the Penrose, Hawking and Hawking-Penrose singularity theorems, cosmic censorship, and exotic causal geometries (traversable wormholes, warp drives). Diagrams and horizons of named spacetimes, energy-condition definitions, the Cauchy problem and asymptotic mass definitions live in their own domains.",
	"concepts": [
		{
			"id": "global-causal-structure",
			"title": "Global causal structure of spacetime",
			"aliases": [
				"causal structure of a curved spacetime",
				"global methods in general relativity",
				"global techniques",
				"causal structure methods"
			],
			"kind": "definition",
			"tier": "advanced",
			"summary": "In a curved spacetime the metric fixes a light cone at every event, and the pattern of these cones, together with a choice of future, decides which events can influence which across the whole manifold. Global methods study this pattern and properties of the manifold as a whole, rather than tensor equations at a point, and they are the tools behind horizons, Cauchy surfaces and singularity theorems.",
			"prerequisites": [
				"local-light-cone",
				"causal-structure-of-minkowski-spacetime"
			],
			"related": [
				{
					"id": "causal-structure-of-minkowski-spacetime",
					"relation": "generalizes"
				},
				{
					"id": "conformal-invariance",
					"relation": "applies"
				}
			],
			"sources": [
				{
					"book": "gifted-amateur",
					"unit": "ch19",
					"depth": "core",
					"names": [
						"causal structure",
						"global techniques"
					]
				},
				{
					"book": "gifted-amateur",
					"unit": "ch50",
					"depth": "mention",
					"names": [
						"global methods in general relativity"
					]
				},
				{
					"book": "legacy",
					"unit": "design-doc-backlog-penrose-kruskal-causal-structure",
					"depth": "introduced",
					"names": [
						"global causal structure"
					]
				}
			],
			"merged_from": [
				"global methods in general relativity",
				"global techniques",
				"causal structure"
			],
			"notes": "Two metrics with the same null cones at every event share the same causal relations, which is why conformal methods (conformal-invariance, owned by manifolds-and-metrics) preserve causal structure. The flat-space version (absolute past, future, elsewhere) is owned by special-relativity."
		},
		{
			"id": "time-orientability",
			"title": "Time orientability",
			"aliases": [
				"time orientation",
				"time-orientable spacetime",
				"future-pointing and past-pointing vectors",
				"future and past sheets of the light cone"
			],
			"kind": "definition",
			"tier": "advanced",
			"summary": "A time orientation is a choice of which half of each light cone counts as the future; a spacetime is time-orientable if that choice can be made continuously over the whole manifold. Then every timelike or null vector is consistently future- or past-pointing, which is needed before causal futures and pasts make sense globally.",
			"prerequisites": [
				"local-light-cone",
				"timelike-spacelike-and-null-vectors"
			],
			"related": [
				{
					"id": "topology-of-spacetime",
					"relation": "applies"
				}
			],
			"sources": [
				{
					"book": "dinverno",
					"unit": "ch08",
					"depth": "developed",
					"names": [
						"time orientation (future- and past-pointing vectors)"
					]
				},
				{
					"book": "gifted-amateur",
					"unit": "ch19",
					"depth": "introduced",
					"names": [
						"time orientability"
					]
				}
			],
			"merged_from": [
				"time orientability",
				"time orientation (future- and past-pointing vectors)"
			],
			"notes": "In Minkowski space a vector X is future-pointing when its inner product with a fixed future timelike reference vector has the appropriate sign (DIV ch08). GA ch19 contrasts a strip of cones glued into a cylinder with and without a flip of future and past, and suggests entropy increase as a practical way to pick the future."
		},
		{
			"id": "causal-curve",
			"title": "Causal curve",
			"aliases": [
				"non-spacelike curve",
				"inextendible causal curve",
				"endless causal curve"
			],
			"kind": "definition",
			"tier": "advanced",
			"summary": "A causal curve is a curve whose tangent is everywhere timelike or null and future-pointing, the possible history of a signal or particle. It is inextendible when it has no endpoint in the spacetime in either direction, the notion used to define Cauchy surfaces and domains of dependence.",
			"prerequisites": [
				"time-orientability",
				"world-line"
			],
			"related": [
				{
					"id": "closed-timelike-curve",
					"relation": "has-part"
				}
			],
			"sources": [
				{
					"book": "legacy",
					"unit": "lesson-causal-domains",
					"depth": "developed",
					"names": [
						"inextendible causal curve"
					]
				}
			],
			"merged_from": [],
			"notes": "Timelike curves as particle histories are owned by special-relativity; this concept adds future direction and inextendibility for global arguments."
		},
		{
			"id": "causal-future-and-past",
			"title": "Causal and chronological future and past",
			"aliases": [
				"causal future",
				"causal past",
				"J+ and J-",
				"I+ and I-",
				"chronological future",
				"absolute future of an event",
				"causal past of an event",
				"causal regions of a world line"
			],
			"kind": "definition",
			"tier": "advanced",
			"summary": "The causal future J+(p) of an event is every event reachable from p along a future causal curve, and the causal past J-(p) is every event from which p can be reached; the chronological versions I+ and I- use timelike curves only and sit inside J+ and J-. These sets, taken for events, world lines or whole regions, are the building blocks of horizons and domains of dependence.",
			"prerequisites": [
				"causal-curve",
				"causal-structure-of-minkowski-spacetime"
			],
			"related": [
				{
					"id": "observer-dependent-horizon",
					"relation": "motivates"
				}
			],
			"sources": [
				{
					"book": "dinverno",
					"unit": "ch02",
					"depth": "developed",
					"names": [
						"causal future",
						"causal past"
					]
				},
				{
					"book": "gifted-amateur",
					"unit": "ch19",
					"depth": "developed",
					"names": [
						"causal past of an event",
						"causal regions of a world line"
					]
				},
				{
					"book": "legacy",
					"unit": "lesson-causal-domains",
					"depth": "developed",
					"names": [
						"I+(p) contained in J+(p)"
					]
				}
			],
			"merged_from": [
				"causal future",
				"causal past",
				"causal past of an event",
				"causal regions of a world line"
			],
			"notes": "GA ch19 splits spacetime relative to a whole world line into regions that can be seen and influenced, only influenced, only seen, or neither; seeing and influencing are bounded by different horizons."
		},
		{
			"id": "closed-timelike-curve",
			"title": "Closed timelike curve",
			"aliases": [
				"CTC",
				"causality violation",
				"timelike loop",
				"closed timelike loops"
			],
			"kind": "phenomenon",
			"tier": "advanced",
			"summary": "A closed timelike curve is a future-directed timelike world line that returns to an event it already passed through, so an observer always moving into their local future meets their own past. Such curves violate causality and are generally regarded as unphysical, yet exact solutions contain them, for instance near the ring singularity of Kerr and in anti-de Sitter space before unwrapping its time.",
			"prerequisites": [
				"causal-curve",
				"local-light-cone"
			],
			"related": [
				{
					"id": "causal-structure-of-minkowski-spacetime",
					"relation": "contrasts-with"
				}
			],
			"sources": [
				{
					"book": "gifted-amateur",
					"unit": "ch19",
					"depth": "introduced",
					"names": [
						"closed timelike curve"
					]
				},
				{
					"book": "gifted-amateur",
					"unit": "ch29",
					"depth": "mention",
					"names": [
						"closed timelike curves"
					]
				},
				{
					"book": "gifted-amateur",
					"unit": "ch49",
					"depth": "mention",
					"names": [
						"closed timelike curves"
					]
				},
				{
					"book": "dinverno",
					"unit": "ch20",
					"depth": "introduced",
					"names": [
						"closed timelike curves"
					]
				}
			],
			"merged_from": [
				"closed timelike curve",
				"closed timelike curves"
			],
			"notes": "Kerr examples: on the negative-r side the axial direction becomes timelike, so circles of constant t, r, theta are timelike (DIV ch20, GA ch29). AdS example: global time runs around a circle on the hyperboloid (GA ch49). Excluding such curves is the chronology condition used in the Hawking-Penrose theorem."
		},
		{
			"id": "topology-of-spacetime",
			"title": "Topology of spacetime",
			"aliases": [
				"global shape of spacetime",
				"spacetime topology",
				"cylindrical topology R x S^3"
			],
			"kind": "definition",
			"tier": "advanced",